{
  "schema_version": "atlas-prime-capability-parity-register-v1",
  "canonical_repository": "Jktomy/atlas-prime",
  "predecessor_repository": "Jktomy/atlas-codex",
  "predecessor_head": "c892dc05ea56db0134a0e865f56d491f9c02ff85",
  "prime_anchor": "c919b491d7dcf406fff9f1996ebe210e524cfc71",
  "register_role": "CANONICAL_CAPABILITY_DISPOSITION",
  "path_disposition_authority": {
    "path": "migration/source-disposition-summary.json",
    "tracked_paths": 525,
    "closed_paths": 525,
    "open_paths": 0,
    "authority_boundary": "Path closure is historical migration evidence and never establishes capability parity."
  },
  "capability_disposition_vocabulary": [
    "PRESERVED",
    "IMPROVED",
    "RESTORED",
    "REPLACED",
    "INTENTIONALLY_RETIRED",
    "BLOCKED",
    "STILL_MISSING"
  ],
  "capability_disposition_counts": {
    "PRESERVED": 4,
    "IMPROVED": 7,
    "RESTORED": 14,
    "REPLACED": 1,
    "INTENTIONALLY_RETIRED": 1,
    "BLOCKED": 0,
    "STILL_MISSING": 1
  },
  "capabilities": [
    {
      "id": "CAP-001",
      "domain": "Canonical authority",
      "capability": "Single clean canonical source repository",
      "audit_status": "PRESERVED_AND_IMPROVED",
      "audit_severity": "GREEN",
      "path_disposition": "CURRENT_PRIME_NATIVE",
      "capability_disposition": "IMPROVED",
      "activation_state": "ACTIVE",
      "current_state": "Prime is the sole canonical source and Codex is frozen predecessor evidence.",
      "required_proof": "Repository policy, source hierarchy, and clean-clone readback."
    },
    {
      "id": "CAP-002",
      "domain": "Startup",
      "capability": "Deterministic startup/read order",
      "audit_status": "RESTORED_STARTUP_READ_ORDER_PROVEN",
      "audit_severity": "GREEN",
      "path_disposition": "HISTORICAL_CLOSED",
      "capability_disposition": "RESTORED",
      "activation_state": "ACTIVE",
      "current_state": "Prime startup validates canonical Quest and continuity source and reconstructs the next safe gate from canonical continuity without chat memory. The universal Feather-bound Sunset journey is accepted separately under AJ-10.",
      "required_proof": "Accepted RP-C05 command/startup transaction and fresh-context canonical continuity readback, with the distinct AJ-10 Sunset/Feather acceptance bound separately."
    },
    {
      "id": "CAP-003",
      "domain": "Command surface",
      "capability": "Full conversational routing doctrine",
      "audit_status": "RESTORED_CANONICAL_ROUTE_SURFACE",
      "audit_severity": "GREEN",
      "path_disposition": "HISTORICAL_CLOSED",
      "capability_disposition": "RESTORED",
      "activation_state": "ACTIVE",
      "current_state": "Prime exposes the canonical source order, route table, automatic method routing, Preview-to-Execute boundary, decision box, stop conditions, rollback, and next-action contract.",
      "required_proof": "Accepted RP-C05 command/startup transaction, routing/command-surfaces.md, and exact-head command-surface tests."
    },
    {
      "id": "CAP-004",
      "domain": "Command surface",
      "capability": "Operational dashboard / Emberline",
      "audit_status": "RESTORED_DETERMINISTIC_EMBERLINE",
      "audit_severity": "GREEN",
      "path_disposition": "HISTORICAL_CLOSED",
      "capability_disposition": "RESTORED",
      "activation_state": "ACTIVE",
      "current_state": "Prime renders a deterministic non-authoritative Emberline from canonical continuity source; generated and projected output never governs.",
      "required_proof": "Accepted RP-C05 deterministic Emberline evidence in proof/repairing-prime/rp-c05-continuity-evidence-r01.json."
    },
    {
      "id": "CAP-005",
      "domain": "Continuity",
      "capability": "Atlas-wide unfinished-work register",
      "audit_status": "RESTORED_CANONICAL_CONTINUITY",
      "audit_severity": "GREEN",
      "path_disposition": "HISTORICAL_CLOSED",
      "capability_disposition": "RESTORED",
      "activation_state": "ACTIVE",
      "current_state": "Prime has a schema-validated canonical continuity register covering every active Quest with exact source digests, blockers, next action, and approval boundary.",
      "required_proof": "Accepted RP-C05 continuity foundation and restart readback in proof/repairing-prime/rp-c05-continuity-evidence-r01.md."
    },
    {
      "id": "CAP-006",
      "domain": "Continuity",
      "capability": "Routine bounded continuity-row updates",
      "audit_status": "RESTORED_ONE_ENTRY_UPDATE_PROVEN",
      "audit_severity": "GREEN",
      "path_disposition": "HISTORICAL_CLOSED",
      "capability_disposition": "RESTORED",
      "activation_state": "ACTIVE",
      "current_state": "Prime plans stale-bound, replay-ledger-bound one-entry continuity updates; accepted AJ-07 changed exactly one canonical entry through a reviewed draft PR.",
      "required_proof": "AJ-07 transaction #120 and accepted RP-C05 evidence in proof/repairing-prime/rp-c05-continuity-evidence-r01.json."
    },
    {
      "id": "CAP-007",
      "domain": "Quest operations",
      "capability": "Canonical Quest registry",
      "audit_status": "PRESERVED_AS_NARROWER_MODEL",
      "audit_severity": "YELLOW",
      "path_disposition": "CURRENT_PRIME_NATIVE",
      "capability_disposition": "PRESERVED",
      "activation_state": "ACTIVE",
      "current_state": "Quest Board remains the sole canonical Quest registry.",
      "required_proof": "Quest Board schema and source readback."
    },
    {
      "id": "CAP-008",
      "domain": "Quest operations",
      "capability": "Routine Quest admission/update without validator code edits",
      "audit_status": "RESTORED_SCHEMA_DRIVEN_ADMISSION_PROVEN",
      "audit_severity": "GREEN",
      "path_disposition": "HISTORICAL_CLOSED",
      "capability_disposition": "RESTORED",
      "activation_state": "ACTIVE",
      "current_state": "Prime admits a later valid Quest through schema and registry rules without changing validator or continuity-engine code; accepted AJ-08 preserves the exact hashes.",
      "required_proof": "AJ-08 transaction #121 and unchanged validator/engine hashes in proof/repairing-prime/rp-c05-continuity-evidence-r01.json."
    },
    {
      "id": "CAP-009",
      "domain": "Hosted execution",
      "capability": "Athena-facing hosted IssueOps",
      "audit_status": "RESTORED_HOSTED_INTAKE_LIVE_PROVEN",
      "audit_severity": "GREEN",
      "path_disposition": "HISTORICAL_CLOSED",
      "capability_disposition": "RESTORED",
      "activation_state": "ACTIVE",
      "current_state": "Prime has an owner-authorized Jayson/Artemis Arrow/Bow intake that invokes the singular Thread Engine and stops at exact harmless draft-PR readback.",
      "required_proof": "Hosted R02 run 29218494916, PR #114, exact-head CI, detached review, and canonical readback in proof/repairing-prime/rp-c01-route-evidence-r01.md."
    },
    {
      "id": "CAP-010",
      "domain": "Hosted execution",
      "capability": "Human-friendly guided Spear intake",
      "audit_status": "RESTORED_GUIDED_INTAKE_LIVE_PROVEN",
      "audit_severity": "GREEN",
      "path_disposition": "HISTORICAL_CLOSED",
      "capability_disposition": "RESTORED",
      "activation_state": "ACTIVE",
      "current_state": "Prime has an owner-guided Preview to Execute publisher over the hosted Bow route. A fresh immutable carrier bound exact canonical main, canonical mission digest, mission/base lock, durable no-retry dispatch receipt, route-created draft PR, exact path/blob readback, exact-head Linux and Windows CI, detached GREEN review, merge, and canonical readback.",
      "required_proof": "Guided construction PR #150, live mission RP-C01-CAP010-GUIDED-LIVE-R01, hosted run 29231950571, route-created PR #151, exact-head CI run 29232042665, detached GREEN review, and canonical readback in proof/repairing-prime/rp-c08-cap010-reconciliation-r01.md."
    },
    {
      "id": "CAP-011",
      "domain": "Hosted execution",
      "capability": "Guarded multi-file source-pack PR workflow",
      "audit_status": "RESTORED_HOSTED_MULTI_FILE_LIVE_PROVEN",
      "audit_severity": "GREEN",
      "path_disposition": "HISTORICAL_CLOSED",
      "capability_disposition": "RESTORED",
      "activation_state": "ACTIVE",
      "current_state": "A fresh owner-hosted ordinary Arrow/Bow carrier invoked the singular Thread Engine to create one immutable draft PR containing exactly two authored proof paths, with exact carrier-to-head blob identity, draft-PR readback, exact-head Linux and Windows CI, detached GREEN review, merge, and canonical-main readback.",
      "required_proof": "Hosted run 29229482018, route-created PR #147 at head 2766deee39a72db9f942fc6bae6ae87e0ca7a8a9, exact-head CI run 29229535410, detached GREEN review, and canonical readback in proof/repairing-prime/rp-c08-cap011-reconciliation-r01.md."
    },
    {
      "id": "CAP-012",
      "domain": "Hosted execution",
      "capability": "Guarded tooling/source/metadata patch workflows",
      "audit_status": "COLLAPSED_WITHOUT_FUNCTIONAL_PARITY",
      "audit_severity": "HIGH",
      "path_disposition": "HISTORICAL_CLOSED",
      "capability_disposition": "INTENTIONALLY_RETIRED",
      "activation_state": "INTENTIONALLY_RETIRED",
      "current_state": "Overlapping patch engines are retired in favor of one exact Prime mission schema and singular engine.",
      "required_proof": "No second normal repository writer and named exact-mission equivalent."
    },
    {
      "id": "CAP-013",
      "domain": "Thread Engine",
      "capability": "Mission-scoped draft-PR production adapter",
      "audit_status": "PRESERVED_AND_IMPROVED",
      "audit_severity": "GREEN",
      "path_disposition": "CURRENT_PRIME_NATIVE",
      "capability_disposition": "IMPROVED",
      "activation_state": "ACTIVE",
      "current_state": "Prime Thread Engine is active, mission-scoped, immutable-branch, and draft-PR-only.",